{
  "_comment": [
    "Geteilte Vektoren des EREIGNIS-VERTRAGS (UEMS AP-07 IP-3, Entscheid E11 = A).",
    "Die Prosa steht in docs/contracts/v2/events-vocabulary.md; hier steht das geschlossene",
    "Vokabular — je Art Urheber, Bezug, Zeitregel, Felder, Fortschreibung und Kundensatz — und",
    "die Fälle, an denen der Umschlag Box → Cloud (mqtt-events-2.1.schema.json) und das",
    "Redpanda-Ereignis events.raw (events-raw.event.schema.json) gemessen werden.",
    "",
    "Gefahren von:",
    "  Java  services/api .../uems/EreignisVokabular (+ EreignisVokabularVectorsTest) — das Urteil",
    "  TS    frontend/portal/src/uemsEreignis.ts (+ uemsEreignis.test.ts) — der Kundensatz",
    "  Java  services/ingest .../EventsContractSchemaTest — Umschläge und Beispiele gegen die Schemas",
    "Wer eine Art, ein Feld oder einen Satz ändert, ändert Java, TS, beide Schemas UND diese Datei.",
    "",
    "⚠ NOCH RUFT NIEMAND AN. Keine Box sendet Ereignisse (erst mit einem Edge-Release,",
    "IP-18/IP-19), die Datenannahme verarbeitet …/v2/events noch nicht (IP-5), es gibt noch",
    "keine Ereignis-Tabelle (IP-8). Bis dahin schreibt der Writer weiter device_measurement_event.",
    "",
    "DIE BEISPIELWELT ist das Referenzunternehmen (uems-referenzunternehmen.json). Jeder Fall,",
    "der ein Ahrenberg-Objekt nennt (E-x, DQ-x, K-x, MS-x, Einbau), übernimmt dessen Werte, und",
    "der Java-Test prüft das gegen die Referenzdatei. Was ein Fall ERFINDET, nennt er in",
    "`annahme` und — für ein Kennzeichen oder einen Messkanal außerhalb der Referenz — in",
    "`erfunden`. Technische Kennungen (UUIDs) nennt die Referenz nicht: `kennungen` legt sie fest.",
    "Zeiten in Ereignissen sind UTC (…Z); der Kundensatz spricht in der Zeitzone des Standorts."
  ],
  "schema_version": "1.0",
  "$schema_datei": "./events-vocabulary.schema.json",
  "bezug": "UEMS AP-07 §4.5, §4.8, §4.9, §5.2 und Entscheid E11 vom 10.09.2026; AP-04 E2, AP-05 E6, AP-06 E5/E7/E9; Herkunftsvertrag ./messwert-herkunft.md",
  "referenzunternehmen": "./uems-referenzunternehmen.json",
  "schemas": {
    "umschlag": "./mqtt-events-2.1.schema.json",
    "redpanda": "./events-raw.event.schema.json"
  },
  "zeitzone": "Europe/Berlin",
  "kennungen": {
    "kundenbereich": {
      "KB-AHRENBERG": "a4e0b000-0000-4000-8000-000000000001"
    },
    "anlagen": {
      "AN-1": "a4e0b000-0000-4000-8000-0000000000a1",
      "AN-2": "a4e0b000-0000-4000-8000-0000000000a2",
      "AN-3": "a4e0b000-0000-4000-8000-0000000000a3"
    },
    "boxen": {
      "E-1": "a4e0b000-0000-4000-8000-0000000000e1",
      "E-2": "a4e0b000-0000-4000-8000-0000000000e2",
      "E-2′": "a4e0b000-0000-4000-8000-0000000002e2",
      "E-3": "a4e0b000-0000-4000-8000-0000000000e3"
    }
  },
  "vokabular": {
    "urheber": [
      {
        "code": "box",
        "wer": "die VoltPilot-Box (sendet über …/v2/events, erst mit einem Edge-Release)"
      },
      {
        "code": "datenannahme",
        "wer": "die Datenannahme der Cloud (services/ingest): Uhr, Fassung, Kennung, Form"
      },
      {
        "code": "writer",
        "wer": "der Schreiber der Cloud (services/timescale-writer): Reihe, Sequenz, Kadenz, Herkunft"
      },
      {
        "code": "cloud",
        "wer": "die übrige Cloud (services/api): Herzschlag, Zuständigkeit"
      },
      {
        "code": "kunde",
        "wer": "ein Mensch im Portal (über services/api) — etwa ein eingetragener Zählerwechsel"
      }
    ],
    "grund": [
      {
        "code": "herkunft_unvollstaendig",
        "von": "writer",
        "text": "Herkunft unvollständig — Gerät oder Einstellung zur Messzeit unbekannt"
      },
      {
        "code": "fassung_unbekannt",
        "von": "datenannahme",
        "text": "unbekannte Fassung des Datenpakets"
      },
      {
        "code": "kennung_abweichend",
        "von": "datenannahme",
        "text": "es nennt eine andere Box, Anlage oder einen anderen Kundenbereich"
      },
      {
        "code": "schema_verletzt",
        "von": "datenannahme",
        "text": "Aufbau des Datenpakets nicht lesbar"
      },
      {
        "code": "wort_unbekannt",
        "von": "datenannahme",
        "text": "unbekanntes Wort — verworfen, nie geraten"
      },
      {
        "code": "urheber_unzulaessig",
        "von": "datenannahme",
        "text": "diese Meldung kommt nie von diesem Absender"
      },
      {
        "code": "zeit_ungueltig",
        "von": "datenannahme",
        "text": "unmögliche Zeitangabe"
      },
      {
        "code": "regel_verletzt",
        "von": "datenannahme",
        "text": "die Angaben widersprechen sich"
      },
      {
        "code": "fortschreibung_unzulaessig",
        "von": "datenannahme",
        "text": "es würde eine frühere Meldung ändern"
      }
    ],
    "strom": [
      "telemetry",
      "measurement-samples",
      "events"
    ],
    "erkannt_aus": [
      {
        "code": "kadenz",
        "urheber": "writer",
        "text": "kein guter Wert über 2 × Kadenz"
      },
      {
        "code": "verdraengung",
        "urheber": "box",
        "text": "die Box hat Werte aus ihrem Puffer verdrängt"
      },
      {
        "code": "herzschlag",
        "urheber": "cloud",
        "text": "die Box meldet sich nicht (Herzschlag)"
      }
    ],
    "anlass_geraetegrenze": [
      "zaehlerwechsel",
      "kartenwechsel",
      "controllerwechsel",
      "zaehler_zurueckgesetzt"
    ],
    "anlass_uebergabe": [
      "uebergabe",
      "box_tausch"
    ],
    "qualitaet": [
      "good",
      "uncertain",
      "invalid",
      "stale",
      "device_error"
    ],
    "fehlerklasse_datei": "./data-source-vectors.json",
    "felder": {
      "ereignis_id": {
        "typ": "uuid",
        "beschreibung": "Die Kennung des Ereignisses, vom Urheber vergeben. Eine Fortschreibung trägt dieselbe."
      },
      "art": {
        "typ": "wort",
        "beschreibung": "Die Ereignisart aus diesem Vokabular."
      },
      "zeitpunkt": {
        "typ": "zeit",
        "beschreibung": "Wann es geschah (UTC, auf die Sekunde) — auf der Zeitachse der Art."
      },
      "von": {
        "typ": "zeit",
        "beschreibung": "Beginn des Zeitraums (UTC)."
      },
      "bis": {
        "typ": "zeit_oder_leer",
        "beschreibung": "Ende des Zeitraums (UTC); leer heißt offen — nur wo die Art es erlaubt."
      },
      "box": {
        "typ": "kennung",
        "beschreibung": "Die VoltPilot-Box, um die es geht (bei Box-Meldungen: die Box aus dem Topic)."
      },
      "box_alt": {
        "typ": "kennung",
        "beschreibung": "Die Box, die bis zum Wechsel zuständig war."
      },
      "box_neu": {
        "typ": "kennung",
        "beschreibung": "Die Box, die ab dem Wechsel zuständig ist."
      },
      "zustaendige_box": {
        "typ": "kennung",
        "beschreibung": "Die Box, die zur Messzeit zuständig war."
      },
      "datenquelle": {
        "typ": "kennung",
        "beschreibung": "Die Datenquelle (Adresse + Protokoll, AP-06)."
      },
      "komponente": {
        "typ": "kennung",
        "beschreibung": "Die Komponente der Reihe."
      },
      "messkanal": {
        "typ": "text",
        "beschreibung": "Der Messkanal der Reihe (Katalog-Schlüssel oder Kern-Kanal)."
      },
      "messstelle": {
        "typ": "kennung",
        "beschreibung": "Die Messstelle, deren führende Quelle die Reihe zu diesem Zeitpunkt ist — nur die Cloud kennt sie."
      },
      "einbau_alt": {
        "typ": "kennung",
        "beschreibung": "Der Einbau (Gerät, AP-04) vor der Grenze."
      },
      "einbau_neu": {
        "typ": "kennung",
        "beschreibung": "Der Einbau ab der Grenze; derselbe wie vorher bei einer Grenze ohne Gerätewechsel."
      },
      "erkannt_aus": {
        "typ": "wort",
        "beschreibung": "Woraus die Lücke erkannt wurde."
      },
      "erwartet_fehlend": {
        "typ": "ganz_ab_0",
        "beschreibung": "Wie viele erwartete Werte fehlen — nur, wenn die Kadenz sie bestimmt; nie geschätzt."
      },
      "nachgeliefert_am": {
        "typ": "zeit_oder_leer",
        "beschreibung": "Eingangszeit des ersten nachgelieferten Werts; bleibt leer, wenn nie etwas kam."
      },
      "fehlerklasse": {
        "typ": "wort",
        "beschreibung": "Die Fehlerklasse je Quelle (AP-06 E5), NUR wenn ein exportierter Fakt sie trägt."
      },
      "ursache_ereignis": {
        "typ": "uuid",
        "beschreibung": "Das Ereignis, das die Lücke erklärt (Gerätegrenze, Übergabe)."
      },
      "eingang_von": {
        "typ": "zeit",
        "beschreibung": "Eingangszeit des ersten Werts."
      },
      "eingang_bis": {
        "typ": "zeit",
        "beschreibung": "Eingangszeit des letzten Werts."
      },
      "anzahl": {
        "typ": "ganz_ab_1",
        "beschreibung": "Wie viele Werte (bzw. Datenpakete) es betrifft."
      },
      "erwartet": {
        "typ": "ganz_ab_1",
        "beschreibung": "Wie viele Werte erwartet waren; der Anteil ist anzahl/erwartet und wird nie gerundet."
      },
      "messzeit": {
        "typ": "zeit",
        "beschreibung": "Die Messzeit des betroffenen Werts."
      },
      "gespeicherter_wert": {
        "typ": "messwert",
        "beschreibung": "Der Wert, der gespeichert ist und bleibt."
      },
      "abgewiesener_wert": {
        "typ": "messwert",
        "beschreibung": "Der Wert, der abgewiesen wurde."
      },
      "sequenzen": {
        "typ": "ganz_liste",
        "beschreibung": "Die Sequenzen des gespeicherten und des abgewiesenen Werts."
      },
      "einheit": {
        "typ": "text",
        "beschreibung": "Die Einheit der Zahlen dieses Ereignisses (aus dem Katalog)."
      },
      "strom": {
        "typ": "wort",
        "beschreibung": "Der Uplink der Box, dessen Datenpaket es betrifft (das Blatt des Topics)."
      },
      "sequenz": {
        "typ": "ganz_ab_0",
        "beschreibung": "Die Sequenz des betroffenen Datenpakets."
      },